"No.","Time","Source","Destination","Protocol","Length","Info"
"59","1.520380","192.168.1.2","160.36.131.221","TCP","54","50570  >  80 [FIN, ACK] Seq=1 Ack=1 Win=1021 Len=0"
"60","1.520429","192.168.1.2","160.36.131.221","TCP","54","50571  >  80 [FIN, ACK] Seq=1 Ack=1 Win=1026 Len=0"
"61","1.520544","192.168.1.2","160.36.131.221","HTTP","595","GET /lapack/lapack-3.7.1.tgz HTTP/1.1 "
"65","1.566516","160.36.131.221","192.168.1.2","TCP","60","80  >  50570 [ACK] Seq=1 Ack=2 Win=131 Len=0"
"66","1.567223","160.36.131.221","192.168.1.2","TCP","60","80  >  50571 [ACK] Seq=1 Ack=2 Win=131 Len=0"
"67","1.567722","160.36.131.221","192.168.1.2","TCP","60","80  >  50572 [ACK] Seq=1 Ack=542 Win=123 Len=0"
"68","1.568862","160.36.131.221","192.168.1.2","TCP","1506","80  >  50572 [ACK] Seq=1 Ack=542 Win=123 Len=1452 [TCP segment of a reassembled PDU]"
"72","1.608691","192.168.1.2","160.36.131.221","TCP","54","50572  >  80 [ACK] Seq=542 Ack=1453 Win=1026 Len=0"
"79","1.654866","160.36.131.221","192.168.1.2","TCP","1506","80  >  50572 [ACK] Seq=1453 Ack=542 Win=123 Len=1452 [TCP segment of a reassembled PDU]"
"81","1.655240","160.36.131.221","192.168.1.2","TCP","1506","80  >  50572 [ACK] Seq=2905 Ack=542 Win=123 Len=1452 [TCP segment of a reassembled PDU]"
"83","1.655263","192.168.1.2","160.36.131.221","TCP","54","50572  >  80 [ACK] Seq=542 Ack=4357 Win=1026 Len=0"
"88","1.707779","160.36.131.221","192.168.1.2","TCP","1506","80  >  50572 [ACK] Seq=4357 Ack=542 Win=123 Len=1452 [TCP segment of a reassembled PDU]"
"89","1.707779","160.36.131.221","192.168.1.2","TCP","1506","80  >  50572 [ACK] Seq=5809 Ack=542 Win=123 Len=1452 [TCP segment of a reassembled PDU]"
"90","1.707779","160.36.131.221","192.168.1.2","TCP","1506","80  >  50572 [ACK] Seq=7261 Ack=542 Win=123 Len=1452 [TCP segment of a reassembled PDU]"
"91","1.707827","192.168.1.2","160.36.131.221","TCP","54","50572  >  80 [ACK] Seq=542 Ack=8713 Win=1026 Len=0"
"92","1.753880","160.36.131.221","192.168.1.2","TCP","1506","80  >  50572 [ACK] Seq=8713 Ack=542 Win=123 Len=1452 [TCP segment of a reassembled PDU]"
"93","1.754155","160.36.131.221","192.168.1.2","TCP","1506","80  >  50572 [ACK] Seq=10165 Ack=542 Win=123 Len=1452 [TCP segment of a reassembled PDU]"
"94","1.754155","160.36.131.221","192.168.1.2","TCP","1506","80  >  50572 [ACK] Seq=11617 Ack=542 Win=123 Len=1452 [TCP segment of a reassembled PDU]"
"95","1.754177","192.168.1.2","160.36.131.221","TCP","54","50572  >  80 [ACK] Seq=542 Ack=13069 Win=1026 Len=0"
"98","1.800344","160.36.131.221","192.168.1.2","TCP","1506","80  >  50572 [ACK] Seq=13069 Ack=542 Win=123 Len=1452 [TCP segment of a reassembled PDU]"
"99","1.800577","160.36.131.221","192.168.1.2","TCP","1506","80  >  50572 [ACK] Seq=14521 Ack=542 Win=123 Len=1452 [TCP segment of a reassembled PDU]"
"100","1.800595","192.168.1.2","160.36.131.221","TCP","54","50572  >  80 [ACK] Seq=542 Ack=15973 Win=1026 Len=0"
"101","1.800831","160.36.131.221","192.168.1.2","TCP","1506","80  >  50572 [ACK] Seq=15973 Ack=542 Win=123 Len=1452 [TCP segment of a reassembled PDU]"
"102","1.801067","160.36.131.221","192.168.1.2","TCP","1506","80  >  50572 [PSH, ACK] Seq=17425 Ack=542 Win=123 Len=1452 [TCP segment of a reassembled PDU]"
"103","1.801079","192.168.1.2","160.36.131.221","TCP","54","50572  >  80 [ACK] Seq=542 Ack=18877 Win=1026 Len=0"
"105","1.846838","160.36.131.221","192.168.1.2","TCP","1506","80  >  50572 [ACK] Seq=18877 Ack=542 Win=123 Len=1452 [TCP segment of a reassembled PDU]"
"106","1.847420","160.36.131.221","192.168.1.2","TCP","1506","80  >  50572 [ACK] Seq=20329 Ack=542 Win=123 Len=1452 [TCP segment of a reassembled PDU]"
"107","1.847420","160.36.131.221","192.168.1.2","TCP","1506","80  >  50572 [ACK] Seq=21781 Ack=542 Win=123 Len=1452 [TCP segment of a reassembled PDU]"
"108","1.847449","192.168.1.2","160.36.131.221","TCP","54","50572  >  80 [ACK] Seq=542 Ack=23233 Win=1026 Len=0"
"109","1.847705","160.36.131.221","192.168.1.2","TCP","1506","80  >  50572 [ACK] Seq=23233 Ack=542 Win=123 Len=1452 [TCP segment of a reassembled PDU]"
"110","1.847705","160.36.131.221","192.168.1.2","TCP","1506","80  >  50572 [ACK] Seq=24685 Ack=542 Win=123 Len=1452 [TCP segment of a reassembled PDU]"
"111","1.847726","192.168.1.2","160.36.131.221","TCP","54","50572  >  80 [ACK] Seq=542 Ack=26137 Win=1026 Len=0"
"112","1.847887","160.36.131.221","192.168.1.2","TCP","1506","80  >  50572 [PSH, ACK] Seq=26137 Ack=542 Win=123 Len=1452 [TCP segment of a reassembled PDU]"
"113","1.847905","192.168.1.2","160.36.131.221","TCP","54","50572  >  80 [ACK] Seq=542 Ack=27589 Win=1026 Len=0"
"114","1.848089","160.36.131.221","192.168.1.2","TCP","1506","80  >  50572 [ACK] Seq=27589 Ack=542 Win=123 Len=1452 [TCP segment of a reassembled PDU]"
"118","1.887462","192.168.1.2","160.36.131.221","TCP","54","50572  >  80 [ACK] Seq=542 Ack=29041 Win=1026 Len=0"
"119","1.895839","160.36.131.221","192.168.1.2","TCP","1506","80  >  50572 [ACK] Seq=29041 Ack=542 Win=123 Len=1452 [TCP segment of a reassembled PDU]"
"120","1.896076","160.36.131.221","192.168.1.2","TCP","1506","80  >  50572 [ACK] Seq=30493 Ack=542 Win=123 Len=1452 [TCP segment of a reassembled PDU]"
"121","1.896095","192.168.1.2","160.36.131.221","TCP","54","50572  >  80 [ACK] Seq=542 Ack=31945 Win=1026 Len=0"
"122","1.896340","160.36.131.221","192.168.1.2","TCP","1506","80  >  50572 [ACK] Seq=31945 Ack=542 Win=123 Len=1452 [TCP segment of a reassembled PDU]"
"123","1.896545","160.36.131.221","192.168.1.2","TCP","1506","80  >  50572 [ACK] Seq=33397 Ack=542 Win=123 Len=1452 [TCP segment of a reassembled PDU]"
"124","1.896558","192.168.1.2","160.36.131.221","TCP","54","50572  >  80 [ACK] Seq=542 Ack=34849 Win=1026 Len=0"
"125","1.896806","160.36.131.221","192.168.1.2","TCP","1506","80  >  50572 [ACK] Seq=34849 Ack=542 Win=123 Len=1452 [TCP segment of a reassembled PDU]"
"126","1.896806","160.36.131.221","192.168.1.2","TCP","1506","80  >  50572 [ACK] Seq=36301 Ack=542 Win=123 Len=1452 [TCP segment of a reassembled PDU]"
"127","1.896824","192.168.1.2","160.36.131.221","TCP","54","50572  >  80 [ACK] Seq=542 Ack=37753 Win=1026 Len=0"
"128","1.897063","160.36.131.221","192.168.1.2","TCP","1506","80  >  50572 [ACK] Seq=37753 Ack=542 Win=123 Len=1452 [TCP segment of a reassembled PDU]"
"129","1.897297","160.36.131.221","192.168.1.2","TCP","1506","80  >  50572 [ACK] Seq=39205 Ack=542 Win=123 Len=1452 [TCP segment of a reassembled PDU]"
"130","1.897307","192.168.1.2","160.36.131.221","TCP","54","50572  >  80 [ACK] Seq=542 Ack=40657 Win=1026 Len=0"
"131","1.933860","160.36.131.221","192.168.1.2","TCP","1506","80  >  50572 [ACK] Seq=40657 Ack=542 Win=123 Len=1452 [TCP segment of a reassembled PDU]"
"132","1.934110","160.36.131.221","192.168.1.2","TCP","1506","80  >  50572 [PSH, ACK] Seq=42109 Ack=542 Win=123 Len=1452 [TCP segment of a reassembled PDU]"
"133","1.934131","192.168.1.2","160.36.131.221","TCP","54","50572  >  80 [ACK] Seq=542 Ack=43561 Win=1026 Len=0"
"134","1.942160","160.36.131.221","192.168.1.2","TCP","1506","80  >  50572 [ACK] Seq=43561 Ack=542 Win=123 Len=1452 [TCP segment of a reassembled PDU]"
"135","1.942392","160.36.131.221","192.168.1.2","TCP","1506","80  >  50572 [ACK] Seq=45013 Ack=542 Win=123 Len=1452 [TCP segment of a reassembled PDU]"
"136","1.942392","160.36.131.221","192.168.1.2","TCP","1506","80  >  50572 [ACK] Seq=46465 Ack=542 Win=123 Len=1452 [TCP segment of a reassembled PDU]"
"137","1.942411","192.168.1.2","160.36.131.221","TCP","54","50572  >  80 [ACK] Seq=542 Ack=47917 Win=1026 Len=0"
"138","1.942551","160.36.131.221","192.168.1.2","TCP","1506","80  >  50572 [ACK] Seq=47917 Ack=542 Win=123 Len=1452 [TCP segment of a reassembled PDU]"
"139","1.942562","192.168.1.2","160.36.131.221","TCP","54","50572  >  80 [ACK] Seq=542 Ack=49369 Win=1026 Len=0"
"140","1.942791","160.36.131.221","192.168.1.2","TCP","1506","80  >  50572 [ACK] Seq=49369 Ack=542 Win=123 Len=1452 [TCP segment of a reassembled PDU]"
"141","1.943073","160.36.131.221","192.168.1.2","TCP","1506","80  >  50572 [ACK] Seq=50821 Ack=542 Win=123 Len=1452 [TCP segment of a reassembled PDU]"
"142","1.943082","192.168.1.2","160.36.131.221","TCP","54","50572  >  80 [ACK] Seq=542 Ack=52273 Win=1026 Len=0"
"143","1.943282","160.36.131.221","192.168.1.2","TCP","1506","80  >  50572 [ACK] Seq=52273 Ack=542 Win=123 Len=1452 [TCP segment of a reassembled PDU]"
"144","1.943530","160.36.131.221","192.168.1.2","TCP","1506","80  >  50572 [ACK] Seq=53725 Ack=542 Win=123 Len=1452 [TCP segment of a reassembled PDU]"
"145","1.943542","192.168.1.2","160.36.131.221","TCP","54","50572  >  80 [ACK] Seq=542 Ack=55177 Win=1026 Len=0"
"146","1.943987","160.36.131.221","192.168.1.2","TCP","1506","80  >  50572 [ACK] Seq=55177 Ack=542 Win=123 Len=1452 [TCP segment of a reassembled PDU]"
"147","1.944191","160.36.131.221","192.168.1.2","TCP","1506","80  >  50572 [PSH, ACK] Seq=56629 Ack=542 Win=123 Len=1452 [TCP segment of a reassembled PDU]"
"148","1.944201","192.168.1.2","160.36.131.221","TCP","54","50572  >  80 [ACK] Seq=542 Ack=58081 Win=1026 Len=0"
"149","1.944274","160.36.131.221","192.168.1.2","TCP","1506","80  >  50572 [ACK] Seq=58081 Ack=542 Win=123 Len=1452 [TCP segment of a reassembled PDU]"
"150","1.944534","160.36.131.221","192.168.1.2","TCP","1506","80  >  50572 [ACK] Seq=59533 Ack=542 Win=123 Len=1452 [TCP segment of a reassembled PDU]"
"151","1.944545","192.168.1.2","160.36.131.221","TCP","54","50572  >  80 [ACK] Seq=542 Ack=60985 Win=1026 Len=0"
"153","1.980331","160.36.131.221","192.168.1.2","TCP","1506","80  >  50572 [ACK] Seq=60985 Ack=542 Win=123 Len=1452 [TCP segment of a reassembled PDU]"
"154","1.980574","160.36.131.221","192.168.1.2","TCP","1506","80  >  50572 [ACK] Seq=62437 Ack=542 Win=123 Len=1452 [TCP segment of a reassembled PDU]"
"155","1.980574","160.36.131.221","192.168.1.2","TCP","1506","80  >  50572 [ACK] Seq=63889 Ack=542 Win=123 Len=1452 [TCP segment of a reassembled PDU]"
"156","1.980604","192.168.1.2","160.36.131.221","TCP","54","50572  >  80 [ACK] Seq=542 Ack=65341 Win=1026 Len=0"
"157","1.980879","160.36.131.221","192.168.1.2","TCP","1506","80  >  50572 [ACK] Seq=65341 Ack=542 Win=123 Len=1452 [TCP segment of a reassembled PDU]"
"158","1.980893","192.168.1.2","160.36.131.221","TCP","54","50572  >  80 [ACK] Seq=542 Ack=66793 Win=1026 Len=0"
"159","1.988569","160.36.131.221","192.168.1.2","TCP","1506","80  >  50572 [ACK] Seq=66793 Ack=542 Win=123 Len=1452 [TCP segment of a reassembled PDU]"
"160","1.988851","160.36.131.221","192.168.1.2","TCP","1506","80  >  50572 [ACK] Seq=68245 Ack=542 Win=123 Len=1452 [TCP segment of a reassembled PDU]"
"161","1.988871","192.168.1.2","160.36.131.221","TCP","54","50572  >  80 [ACK] Seq=542 Ack=69697 Win=1026 Len=0"
"162","1.989081","160.36.131.221","192.168.1.2","TCP","1506","80  >  50572 [ACK] Seq=69697 Ack=542 Win=123 Len=1452 [TCP segment of a reassembled PDU]"
"163","1.989533","160.36.131.221","192.168.1.2","TCP","1506","80  >  50572 [ACK] Seq=71149 Ack=542 Win=123 Len=1452 [TCP segment of a reassembled PDU]"
"164","1.989533","160.36.131.221","192.168.1.2","TCP","1506","80  >  50572 [ACK] Seq=72601 Ack=542 Win=123 Len=1452 [TCP segment of a reassembled PDU]"
"165","1.989533","160.36.131.221","192.168.1.2","TCP","1506","80  >  50572 [ACK] Seq=74053 Ack=542 Win=123 Len=1452 [TCP segment of a reassembled PDU]"
"166","1.989557","192.168.1.2","160.36.131.221","TCP","54","50572  >  80 [ACK] Seq=542 Ack=75505 Win=1026 Len=0"
"167","1.989916","160.36.131.221","192.168.1.2","TCP","1506","80  >  50572 [ACK] Seq=75505 Ack=542 Win=123 Len=1452 [TCP segment of a reassembled PDU]"
"168","1.990119","160.36.131.221","192.168.1.2","TCP","1506","80  >  50572 [PSH, ACK] Seq=76957 Ack=542 Win=123 Len=1452 [TCP segment of a reassembled PDU]"
"169","1.990132","192.168.1.2","160.36.131.221","TCP","54","50572  >  80 [ACK] Seq=542 Ack=78409 Win=1026 Len=0"
"170","1.990325","160.36.131.221","192.168.1.2","TCP","1506","80  >  50572 [ACK] Seq=78409 Ack=542 Win=123 Len=1452 [TCP segment of a reassembled PDU]"
"171","1.990530","160.36.131.221","192.168.1.2","TCP","1506","80  >  50572 [ACK] Seq=79861 Ack=542 Win=123 Len=1452 [TCP segment of a reassembled PDU]"
"172","1.990541","192.168.1.2","160.36.131.221","TCP","54","50572  >  80 [ACK] Seq=542 Ack=81313 Win=1026 Len=0"
"173","1.990781","160.36.131.221","192.168.1.2","TCP","1506","80  >  50572 [ACK] Seq=81313 Ack=542 Win=123 Len=1452 [TCP segment of a reassembled PDU]"
"174","1.991073","160.36.131.221","192.168.1.2","TCP","1506","80  >  50572 [ACK] Seq=82765 Ack=542 Win=123 Len=1452 [TCP segment of a reassembled PDU]"
"175","1.991082","192.168.1.2","160.36.131.221","TCP","54","50572  >  80 [ACK] Seq=542 Ack=84217 Win=1026 Len=0"
"176","1.991281","160.36.131.221","192.168.1.2","TCP","1506","80  >  50572 [ACK] Seq=84217 Ack=542 Win=123 Len=1452 [TCP segment of a reassembled PDU]"
"177","1.991519","160.36.131.221","192.168.1.2","TCP","1506","80  >  50572 [ACK] Seq=85669 Ack=542 Win=123 Len=1452 [TCP segment of a reassembled PDU]"
"178","1.991527","192.168.1.2","160.36.131.221","TCP","54","50572  >  80 [ACK] Seq=542 Ack=87121 Win=1026 Len=0"
"179","1.991773","160.36.131.221","192.168.1.2","TCP","1506","80  >  50572 [ACK] Seq=87121 Ack=542 Win=123 Len=1452 [TCP segment of a reassembled PDU]"
"180","1.991773","160.36.131.221","192.168.1.2","TCP","1506","80  >  50572 [ACK] Seq=88573 Ack=542 Win=123 Len=1452 [TCP segment of a reassembled PDU]"
"181","1.991788","192.168.1.2","160.36.131.221","TCP","54","50572  >  80 [ACK] Seq=542 Ack=90025 Win=1026 Len=0"
"182","1.992063","160.36.131.221","192.168.1.2","TCP","1506","80  >  50572 [ACK] Seq=90025 Ack=542 Win=123 Len=1452 [TCP segment of a reassembled PDU]"
"183","1.992293","160.36.131.221","192.168.1.2","TCP","1506","80  >  50572 [ACK] Seq=91477 Ack=542 Win=123 Len=1452 [TCP segment of a reassembled PDU]"
"184","1.992301","192.168.1.2","160.36.131.221","TCP","54","50572  >  80 [ACK] Seq=542 Ack=92929 Win=1026 Len=0"
"186","2.026846","160.36.131.221","192.168.1.2","TCP","1506","80  >  50572 [ACK] Seq=92929 Ack=542 Win=123 Len=1452 [TCP segment of a reassembled PDU]"
"187","2.026846","160.36.131.221","192.168.1.2","TCP","1506","80  >  50572 [ACK] Seq=94381 Ack=542 Win=123 Len=1452 [TCP segment of a reassembled PDU]"
"188","2.026892","192.168.1.2","160.36.131.221","TCP","54","50572  >  80 [ACK] Seq=542 Ack=95833 Win=1026 Len=0"
"189","2.027099","160.36.131.221","192.168.1.2","TCP","1506","80  >  50572 [ACK] Seq=95833 Ack=542 Win=123 Len=1452 [TCP segment of a reassembled PDU]"
"190","2.027303","160.36.131.221","192.168.1.2","TCP","1506","80  >  50572 [ACK] Seq=97285 Ack=542 Win=123 Len=1452 [TCP segment of a reassembled PDU]"
"191","2.027312","192.168.1.2","160.36.131.221","TCP","54","50572  >  80 [ACK] Seq=542 Ack=98737 Win=1026 Len=0"
"192","2.027543","160.36.131.221","192.168.1.2","TCP","1506","80  >  50572 [ACK] Seq=98737 Ack=542 Win=123 Len=1452 [TCP segment of a reassembled PDU]"
"193","2.027879","160.36.131.221","192.168.1.2","TCP","1506","80  >  50572 [PSH, ACK] Seq=100189 Ack=542 Win=123 Len=1452 [TCP segment of a reassembled PDU]"
"194","2.027892","192.168.1.2","160.36.131.221","TCP","54","50572  >  80 [ACK] Seq=542 Ack=101641 Win=1026 Len=0"
"195","2.035021","160.36.131.221","192.168.1.2","TCP","1506","80  >  50572 [ACK] Seq=101641 Ack=542 Win=123 Len=1452 [TCP segment of a reassembled PDU]"
"196","2.035253","160.36.131.221","192.168.1.2","TCP","1506","80  >  50572 [ACK] Seq=103093 Ack=542 Win=123 Len=1452 [TCP segment of a reassembled PDU]"
"197","2.035271","192.168.1.2","160.36.131.221","TCP","54","50572  >  80 [ACK] Seq=542 Ack=104545 Win=1026 Len=0"
"198","2.035486","160.36.131.221","192.168.1.2","TCP","1506","80  >  50572 [ACK] Seq=104545 Ack=542 Win=123 Len=1452 [TCP segment of a reassembled PDU]"
"199","2.035966","160.36.131.221","192.168.1.2","TCP","1506","80  >  50572 [ACK] Seq=105997 Ack=542 Win=123 Len=1452 [TCP segment of a reassembled PDU]"
"200","2.035966","160.36.131.221","192.168.1.2","TCP","1506","80  >  50572 [ACK] Seq=107449 Ack=542 Win=123 Len=1452 [TCP segment of a reassembled PDU]"
"201","2.035983","192.168.1.2","160.36.131.221","TCP","54","50572  >  80 [ACK] Seq=542 Ack=108901 Win=1026 Len=0"
"202","2.036229","160.36.131.221","192.168.1.2","TCP","1506","80  >  50572 [ACK] Seq=108901 Ack=542 Win=123 Len=1452 [TCP segment of a reassembled PDU]"
"203","2.036240","192.168.1.2","160.36.131.221","TCP","54","50572  >  80 [ACK] Seq=542 Ack=110353 Win=1026 Len=0"
"204","2.036518","160.36.131.221","192.168.1.2","TCP","1506","80  >  50572 [ACK] Seq=110353 Ack=542 Win=123 Len=1452 [TCP segment of a reassembled PDU]"
"205","2.036518","160.36.131.221","192.168.1.2","TCP","1506","80  >  50572 [ACK] Seq=111805 Ack=542 Win=123 Len=1452 [TCP segment of a reassembled PDU]"
"206","2.036534","192.168.1.2","160.36.131.221","TCP","54","50572  >  80 [ACK] Seq=542 Ack=113257 Win=1026 Len=0"
"207","2.036859","160.36.131.221","192.168.1.2","TCP","1506","80  >  50572 [ACK] Seq=113257 Ack=542 Win=123 Len=1452 [TCP segment of a reassembled PDU]"
"208","2.037067","160.36.131.221","192.168.1.2","TCP","1506","80  >  50572 [ACK] Seq=114709 Ack=542 Win=123 Len=1452 [TCP segment of a reassembled PDU]"
"209","2.037077","192.168.1.2","160.36.131.221","TCP","54","50572  >  80 [ACK] Seq=542 Ack=116161 Win=1026 Len=0"
"210","2.037277","160.36.131.221","192.168.1.2","TCP","1506","80  >  50572 [ACK] Seq=116161 Ack=542 Win=123 Len=1452 [TCP segment of a reassembled PDU]"
"211","2.037484","160.36.131.221","192.168.1.2","TCP","1506","80  >  50572 [ACK] Seq=117613 Ack=542 Win=123 Len=1452 [TCP segment of a reassembled PDU]"
"212","2.037492","192.168.1.2","160.36.131.221","TCP","54","50572  >  80 [ACK] Seq=542 Ack=119065 Win=1026 Len=0"
"213","2.037847","160.36.131.221","192.168.1.2","TCP","1506","80  >  50572 [ACK] Seq=119065 Ack=542 Win=123 Len=1452 [TCP segment of a reassembled PDU]"
"214","2.038055","160.36.131.221","192.168.1.2","TCP","1506","80  >  50572 [ACK] Seq=120517 Ack=542 Win=123 Len=1452 [TCP segment of a reassembled PDU]"
"215","2.038064","192.168.1.2","160.36.131.221","TCP","54","50572  >  80 [ACK] Seq=542 Ack=121969 Win=1026 Len=0"
"216","2.038263","160.36.131.221","192.168.1.2","TCP","1506","80  >  50572 [ACK] Seq=121969 Ack=542 Win=123 Len=1452 [TCP segment of a reassembled PDU]"
"217","2.038497","160.36.131.221","192.168.1.2","TCP","1506","80  >  50572 [ACK] Seq=123421 Ack=542 Win=123 Len=1452 [TCP segment of a reassembled PDU]"
"218","2.038505","192.168.1.2","160.36.131.221","TCP","54","50572  >  80 [ACK] Seq=542 Ack=124873 Win=1026 Len=0"
"219","2.039595","160.36.131.221","192.168.1.2","TCP","1506","80  >  50572 [ACK] Seq=124873 Ack=542 Win=123 Len=1452 [TCP segment of a reassembled PDU]"
"220","2.039595","160.36.131.221","192.168.1.2","TCP","1506","80  >  50572 [PSH, ACK] Seq=126325 Ack=542 Win=123 Len=1452 [TCP segment of a reassembled PDU]"
"221","2.039595","160.36.131.221","192.168.1.2","TCP","1506","80  >  50572 [ACK] Seq=127777 Ack=542 Win=123 Len=1452 [TCP segment of a reassembled PDU]"
"222","2.039595","160.36.131.221","192.168.1.2","TCP","1506","80  >  50572 [ACK] Seq=129229 Ack=542 Win=123 Len=1452 [TCP segment of a reassembled PDU]"
"223","2.039595","160.36.131.221","192.168.1.2","TCP","1506","80  >  50572 [ACK] Seq=130681 Ack=542 Win=123 Len=1452 [TCP segment of a reassembled PDU]"
"224","2.039619","192.168.1.2","160.36.131.221","TCP","54","50572  >  80 [ACK] Seq=542 Ack=132133 Win=1026 Len=0"
"225","2.040590","160.36.131.221","192.168.1.2","TCP","1506","80  >  50572 [ACK] Seq=132133 Ack=542 Win=123 Len=1452 [TCP segment of a reassembled PDU]"
"226","2.040590","160.36.131.221","192.168.1.2","TCP","1506","80  >  50572 [ACK] Seq=133585 Ack=542 Win=123 Len=1452 [TCP segment of a reassembled PDU]"
"227","2.040590","160.36.131.221","192.168.1.2","TCP","1506","80  >  50572 [ACK] Seq=135037 Ack=542 Win=123 Len=1452 [TCP segment of a reassembled PDU]"
"228","2.040590","160.36.131.221","192.168.1.2","TCP","1506","80  >  50572 [ACK] Seq=136489 Ack=542 Win=123 Len=1452 [TCP segment of a reassembled PDU]"
"229","2.040609","192.168.1.2","160.36.131.221","TCP","54","50572  >  80 [ACK] Seq=542 Ack=137941 Win=1026 Len=0"
"230","2.040815","160.36.131.221","192.168.1.2","TCP","1506","80  >  50572 [ACK] Seq=137941 Ack=542 Win=123 Len=1452 [TCP segment of a reassembled PDU]"
"231","2.040828","192.168.1.2","160.36.131.221","TCP","54","50572  >  80 [ACK] Seq=542 Ack=139393 Win=1026 Len=0"
"235","2.073009","160.36.131.221","192.168.1.2","TCP","1506","80  >  50572 [ACK] Seq=139393 Ack=542 Win=123 Len=1452 [TCP segment of a reassembled PDU]"
"236","2.073246","160.36.131.221","192.168.1.2","TCP","1506","80  >  50572 [ACK] Seq=140845 Ack=542 Win=123 Len=1452 [TCP segment of a reassembled PDU]"
"237","2.073277","192.168.1.2","160.36.131.221","TCP","54","50572  >  80 [ACK] Seq=542 Ack=142297 Win=1026 Len=0"
"238","2.073466","160.36.131.221","192.168.1.2","TCP","1506","80  >  50572 [ACK] Seq=142297 Ack=542 Win=123 Len=1452 [TCP segment of a reassembled PDU]"
"239","2.074233","160.36.131.221","192.168.1.2","TCP","1506","80  >  50572 [ACK] Seq=143749 Ack=542 Win=123 Len=1452 [TCP segment of a reassembled PDU]"
"240","2.074233","160.36.131.221","192.168.1.2","TCP","1506","80  >  50572 [ACK] Seq=145201 Ack=542 Win=123 Len=1452 [TCP segment of a reassembled PDU]"
"241","2.074233","160.36.131.221","192.168.1.2","TCP","1506","80  >  50572 [ACK] Seq=146653 Ack=542 Win=123 Len=1452 [TCP segment of a reassembled PDU]"
"242","2.074233","160.36.131.221","192.168.1.2","TCP","1506","80  >  50572 [ACK] Seq=148105 Ack=542 Win=123 Len=1452 [TCP segment of a reassembled PDU]"
"243","2.074253","192.168.1.2","160.36.131.221","TCP","54","50572  >  80 [ACK] Seq=542 Ack=149557 Win=1026 Len=0"
"244","2.074482","160.36.131.221","192.168.1.2","TCP","1506","80  >  50572 [ACK] Seq=149557 Ack=542 Win=123 Len=1452 [TCP segment of a reassembled PDU]"
"246","2.074490","192.168.1.2","160.36.131.221","TCP","54","50572  >  80 [ACK] Seq=542 Ack=151009 Win=1026 Len=0"
"248","2.081257","160.36.131.221","192.168.1.2","TCP","1506","80  >  50572 [ACK] Seq=151009 Ack=542 Win=123 Len=1452 [TCP segment of a reassembled PDU]"
"249","2.081488","160.36.131.221","192.168.1.2","TCP","1506","80  >  50572 [ACK] Seq=152461 Ack=542 Win=123 Len=1452 [TCP segment of a reassembled PDU]"
"250","2.081505","192.168.1.2","160.36.131.221","TCP","54","50572  >  80 [ACK] Seq=542 Ack=153913 Win=1026 Len=0"
"251","2.081739","160.36.131.221","192.168.1.2","TCP","1506","80  >  50572 [ACK] Seq=153913 Ack=542 Win=123 Len=1452 [TCP segment of a reassembled PDU]"
"252","2.081974","160.36.131.221","192.168.1.2","TCP","1506","80  >  50572 [ACK] Seq=155365 Ack=542 Win=123 Len=1452 [TCP segment of a reassembled PDU]"
"253","2.081985","192.168.1.2","160.36.131.221","TCP","54","50572  >  80 [ACK] Seq=542 Ack=156817 Win=1026 Len=0"
"254","2.082234","160.36.131.221","192.168.1.2","TCP","1506","80  >  50572 [ACK] Seq=156817 Ack=542 Win=123 Len=1452 [TCP segment of a reassembled PDU]"
"255","2.082234","160.36.131.221","192.168.1.2","TCP","1506","80  >  50572 [PSH, ACK] Seq=158269 Ack=542 Win=123 Len=1452 [TCP segment of a reassembled PDU]"
"256","2.082246","192.168.1.2","160.36.131.221","TCP","54","50572  >  80 [ACK] Seq=542 Ack=159721 Win=1026 Len=0"
"257","2.082746","160.36.131.221","192.168.1.2","TCP","1506","80  >  50572 [ACK] Seq=159721 Ack=542 Win=123 Len=1452 [TCP segment of a reassembled PDU]"
"258","2.082982","160.36.131.221","192.168.1.2","TCP","1506","80  >  50572 [ACK] Seq=161173 Ack=542 Win=123 Len=1452 [TCP segment of a reassembled PDU]"
"259","2.082992","192.168.1.2","160.36.131.221","TCP","54","50572  >  80 [ACK] Seq=542 Ack=162625 Win=1026 Len=0"
"260","2.083229","160.36.131.221","192.168.1.2","TCP","1506","80  >  50572 [ACK] Seq=162625 Ack=542 Win=123 Len=1452 [TCP segment of a reassembled PDU]"
"261","2.083795","160.36.131.221","192.168.1.2","TCP","1506","80  >  50572 [ACK] Seq=164077 Ack=542 Win=123 Len=1452 [TCP segment of a reassembled PDU]"
"262","2.083795","160.36.131.221","192.168.1.2","TCP","1506","80  >  50572 [ACK] Seq=165529 Ack=542 Win=123 Len=1452 [TCP segment of a reassembled PDU]"
"263","2.083815","192.168.1.2","160.36.131.221","TCP","54","50572  >  80 [ACK] Seq=542 Ack=166981 Win=1026 Len=0"
"264","2.084050","160.36.131.221","192.168.1.2","TCP","1506","80  >  50572 [ACK] Seq=166981 Ack=542 Win=123 Len=1452 [TCP segment of a reassembled PDU]"
"265","2.084064","192.168.1.2","160.36.131.221","TCP","54","50572  >  80 [ACK] Seq=542 Ack=168433 Win=1026 Len=0"
"266","2.084268","160.36.131.221","192.168.1.2","TCP","1506","80  >  50572 [ACK] Seq=168433 Ack=542 Win=123 Len=1452 [TCP segment of a reassembled PDU]"
"267","2.084471","160.36.131.221","192.168.1.2","TCP","1506","80  >  50572 [ACK] Seq=169885 Ack=542 Win=123 Len=1452 [TCP segment of a reassembled PDU]"
"268","2.084483","192.168.1.2","160.36.131.221","TCP","54","50572  >  80 [ACK] Seq=542 Ack=171337 Win=1026 Len=0"
"269","2.084726","160.36.131.221","192.168.1.2","TCP","1506","80  >  50572 [ACK] Seq=171337 Ack=542 Win=123 Len=1452 [TCP segment of a reassembled PDU]"
"270","2.085299","160.36.131.221","192.168.1.2","TCP","1506","80  >  50572 [ACK] Seq=172789 Ack=542 Win=123 Len=1452 [TCP segment of a reassembled PDU]"
"271","2.085299","160.36.131.221","192.168.1.2","TCP","1506","80  >  50572 [ACK] Seq=174241 Ack=542 Win=123 Len=1452 [TCP segment of a reassembled PDU]"
"272","2.085299","160.36.131.221","192.168.1.2","TCP","1506","80  >  50572 [ACK] Seq=175693 Ack=542 Win=123 Len=1452 [TCP segment of a reassembled PDU]"
"273","2.085315","192.168.1.2","160.36.131.221","TCP","54","50572  >  80 [ACK] Seq=542 Ack=177145 Win=1026 Len=0"
"274","2.085477","160.36.131.221","192.168.1.2","TCP","1506","80  >  50572 [ACK] Seq=177145 Ack=542 Win=123 Len=1452 [TCP segment of a reassembled PDU]"
"275","2.085724","160.36.131.221","192.168.1.2","TCP","1506","80  >  50572 [ACK] Seq=178597 Ack=542 Win=123 Len=1452 [TCP segment of a reassembled PDU]"
"276","2.085736","192.168.1.2","160.36.131.221","TCP","54","50572  >  80 [ACK] Seq=542 Ack=180049 Win=1026 Len=0"
"277","2.086212","160.36.131.221","192.168.1.2","TCP","1506","80  >  50572 [ACK] Seq=180049 Ack=542 Win=123 Len=1452 [TCP segment of a reassembled PDU]"
"278","2.086427","160.36.131.221","192.168.1.2","TCP","1506","80  >  50572 [ACK] Seq=181501 Ack=542 Win=123 Len=1452 [TCP segment of a reassembled PDU]"
"279","2.086440","192.168.1.2","160.36.131.221","TCP","54","50572  >  80 [ACK] Seq=542 Ack=182953 Win=1026 Len=0"
"280","2.086669","160.36.131.221","192.168.1.2","TCP","1506","80  >  50572 [ACK] Seq=182953 Ack=542 Win=123 Len=1452 [TCP segment of a reassembled PDU]"
"281","2.086813","160.36.131.221","192.168.1.2","TCP","1506","80  >  50572 [ACK] Seq=184405 Ack=542 Win=123 Len=1452 [TCP segment of a reassembled PDU]"
"282","2.086825","192.168.1.2","160.36.131.221","TCP","54","50572  >  80 [ACK] Seq=542 Ack=185857 Win=1026 Len=0"
"283","2.087028","160.36.131.221","192.168.1.2","TCP","1506","80  >  50572 [ACK] Seq=185857 Ack=542 Win=123 Len=1452 [TCP segment of a reassembled PDU]"
"284","2.087238","160.36.131.221","192.168.1.2","TCP","1506","80  >  50572 [ACK] Seq=187309 Ack=542 Win=123 Len=1452 [TCP segment of a reassembled PDU]"
"285","2.087250","192.168.1.2","160.36.131.221","TCP","54","50572  >  80 [ACK] Seq=542 Ack=188761 Win=1026 Len=0"
"286","2.087464","160.36.131.221","192.168.1.2","TCP","1506","80  >  50572 [ACK] Seq=188761 Ack=542 Win=123 Len=1452 [TCP segment of a reassembled PDU]"
"287","2.087464","160.36.131.221","192.168.1.2","TCP","1506","80  >  50572 [ACK] Seq=190213 Ack=542 Win=123 Len=1452 [TCP segment of a reassembled PDU]"
"288","2.087476","192.168.1.2","160.36.131.221","TCP","54","50572  >  80 [ACK] Seq=542 Ack=191665 Win=1026 Len=0"
"289","2.087725","160.36.131.221","192.168.1.2","TCP","1506","80  >  50572 [ACK] Seq=191665 Ack=542 Win=123 Len=1452 [TCP segment of a reassembled PDU]"
"290","2.087976","160.36.131.221","192.168.1.2","TCP","1506","80  >  50572 [ACK] Seq=193117 Ack=542 Win=123 Len=1452 [TCP segment of a reassembled PDU]"
"291","2.087987","192.168.1.2","160.36.131.221","TCP","54","50572  >  80 [ACK] Seq=542 Ack=194569 Win=1026 Len=0"
"292","2.088226","160.36.131.221","192.168.1.2","TCP","1506","80  >  50572 [ACK] Seq=194569 Ack=542 Win=123 Len=1452 [TCP segment of a reassembled PDU]"
"293","2.088479","160.36.131.221","192.168.1.2","TCP","1506","80  >  50572 [PSH, ACK] Seq=196021 Ack=542 Win=123 Len=1452 [TCP segment of a reassembled PDU]"
"294","2.088488","192.168.1.2","160.36.131.221","TCP","54","50572  >  80 [ACK] Seq=542 Ack=197473 Win=1026 Len=0"
"295","2.088727","160.36.131.221","192.168.1.2","TCP","1506","80  >  50572 [ACK] Seq=197473 Ack=542 Win=123 Len=1452 [TCP segment of a reassembled PDU]"
"296","2.088977","160.36.131.221","192.168.1.2","TCP","1506","80  >  50572 [ACK] Seq=198925 Ack=542 Win=123 Len=1452 [TCP segment of a reassembled PDU]"
"297","2.088989","192.168.1.2","160.36.131.221","TCP","54","50572  >  80 [ACK] Seq=542 Ack=200377 Win=1026 Len=0"
"298","2.089222","160.36.131.221","192.168.1.2","TCP","1506","80  >  50572 [ACK] Seq=200377 Ack=542 Win=123 Len=1452 [TCP segment of a reassembled PDU]"
"299","2.089467","160.36.131.221","192.168.1.2","TCP","1506","80  >  50572 [ACK] Seq=201829 Ack=542 Win=123 Len=1452 [TCP segment of a reassembled PDU]"
"300","2.089475","192.168.1.2","160.36.131.221","TCP","54","50572  >  80 [ACK] Seq=542 Ack=203281 Win=1026 Len=0"
"301","2.089716","160.36.131.221","192.168.1.2","TCP","1506","80  >  50572 [ACK] Seq=203281 Ack=542 Win=123 Len=1452 [TCP segment of a reassembled PDU]"
"302","2.089968","160.36.131.221","192.168.1.2","TCP","1506","80  >  50572 [ACK] Seq=204733 Ack=542 Win=123 Len=1452 [TCP segment of a reassembled PDU]"
"303","2.089975","192.168.1.2","160.36.131.221","TCP","54","50572  >  80 [ACK] Seq=542 Ack=206185 Win=1026 Len=0"
"310","2.119015","160.36.131.221","192.168.1.2","TCP","1506","80  >  50572 [ACK] Seq=206185 Ack=542 Win=123 Len=1452 [TCP segment of a reassembled PDU]"
"311","2.119481","160.36.131.221","192.168.1.2","TCP","1506","80  >  50572 [ACK] Seq=207637 Ack=542 Win=123 Len=1452 [TCP segment of a reassembled PDU]"
"312","2.119502","192.168.1.2","160.36.131.221","TCP","54","50572  >  80 [ACK] Seq=542 Ack=209089 Win=1026 Len=0"
"313","2.120241","160.36.131.221","192.168.1.2","TCP","1506","80  >  50572 [ACK] Seq=209089 Ack=542 Win=123 Len=1452 [TCP segment of a reassembled PDU]"
"314","2.120488","160.36.131.221","192.168.1.2","TCP","1506","80  >  50572 [ACK] Seq=210541 Ack=542 Win=123 Len=1452 [TCP segment of a reassembled PDU]"
"315","2.120501","192.168.1.2","160.36.131.221","TCP","54","50572  >  80 [ACK] Seq=542 Ack=211993 Win=1026 Len=0"
"316","2.120736","160.36.131.221","192.168.1.2","TCP","1506","80  >  50572 [ACK] Seq=211993 Ack=542 Win=123 Len=1452 [TCP segment of a reassembled PDU]"
"317","2.120974","160.36.131.221","192.168.1.2","TCP","1506","80  >  50572 [ACK] Seq=213445 Ack=542 Win=123 Len=1452 [TCP segment of a reassembled PDU]"
"318","2.120974","160.36.131.221","192.168.1.2","TCP","1506","80  >  50572 [ACK] Seq=214897 Ack=542 Win=123 Len=1452 [TCP segment of a reassembled PDU]"
"319","2.120986","192.168.1.2","160.36.131.221","TCP","54","50572  >  80 [ACK] Seq=542 Ack=216349 Win=1026 Len=0"
"320","2.121220","160.36.131.221","192.168.1.2","TCP","1506","80  >  50572 [ACK] Seq=216349 Ack=542 Win=123 Len=1452 [TCP segment of a reassembled PDU]"
"321","2.121230","192.168.1.2","160.36.131.221","TCP","54","50572  >  80 [ACK] Seq=542 Ack=217801 Win=1026 Len=0"
"322","2.121469","160.36.131.221","192.168.1.2","TCP","1506","80  >  50572 [ACK] Seq=217801 Ack=542 Win=123 Len=1452 [TCP segment of a reassembled PDU]"
"323","2.121732","160.36.131.221","192.168.1.2","TCP","1506","80  >  50572 [ACK] Seq=219253 Ack=542 Win=123 Len=1452 [TCP segment of a reassembled PDU]"
"324","2.121741","192.168.1.2","160.36.131.221","TCP","54","50572  >  80 [ACK] Seq=542 Ack=220705 Win=1026 Len=0"
"325","2.127498","160.36.131.221","192.168.1.2","TCP","1506","80  >  50572 [ACK] Seq=220705 Ack=542 Win=123 Len=1452 [TCP segment of a reassembled PDU]"
"326","2.127733","160.36.131.221","192.168.1.2","TCP","1506","80  >  50572 [ACK] Seq=222157 Ack=542 Win=123 Len=1452 [TCP segment of a reassembled PDU]"
"327","2.127733","160.36.131.221","192.168.1.2","TCP","1506","80  >  50572 [ACK] Seq=223609 Ack=542 Win=123 Len=1452 [TCP segment of a reassembled PDU]"
"328","2.127757","192.168.1.2","160.36.131.221","TCP","54","50572  >  80 [ACK] Seq=542 Ack=225061 Win=1026 Len=0"
"329","2.130323","160.36.131.221","192.168.1.2","TCP","1506","80  >  50572 [ACK] Seq=225061 Ack=542 Win=123 Len=1452 [TCP segment of a reassembled PDU]"
"330","2.130323","160.36.131.221","192.168.1.2","TCP","1506","80  >  50572 [ACK] Seq=226513 Ack=542 Win=123 Len=1452 [TCP segment of a reassembled PDU]"
"331","2.130323","160.36.131.221","192.168.1.2","TCP","1506","80  >  50572 [ACK] Seq=227965 Ack=542 Win=123 Len=1452 [TCP segment of a reassembled PDU]"
"332","2.130323","160.36.131.221","192.168.1.2","TCP","1506","80  >  50572 [ACK] Seq=229417 Ack=542 Win=123 Len=1452 [TCP segment of a reassembled PDU]"
"333","2.130323","160.36.131.221","192.168.1.2","TCP","1506","80  >  50572 [ACK] Seq=230869 Ack=542 Win=123 Len=1452 [TCP segment of a reassembled PDU]"
"334","2.130323","160.36.131.221","192.168.1.2","TCP","1506","80  >  50572 [ACK] Seq=232321 Ack=542 Win=123 Len=1452 [TCP segment of a reassembled PDU]"
"335","2.130323","160.36.131.221","192.168.1.2","TCP","1506","80  >  50572 [ACK] Seq=233773 Ack=542 Win=123 Len=1452 [TCP segment of a reassembled PDU]"
"336","2.130323","160.36.131.221","192.168.1.2","TCP","1506","80  >  50572 [ACK] Seq=235225 Ack=542 Win=123 Len=1452 [TCP segment of a reassembled PDU]"
"337","2.130323","160.36.131.221","192.168.1.2","TCP","1506","80  >  50572 [ACK] Seq=236677 Ack=542 Win=123 Len=1452 [TCP segment of a reassembled PDU]"
"338","2.130323","160.36.131.221","192.168.1.2","TCP","1506","80  >  50572 [ACK] Seq=238129 Ack=542 Win=123 Len=1452 [TCP segment of a reassembled PDU]"
"339","2.130376","192.168.1.2","160.36.131.221","TCP","54","50572  >  80 [ACK] Seq=542 Ack=239581 Win=1026 Len=0"
"340","2.130559","160.36.131.221","192.168.1.2","TCP","1506","80  >  50572 [ACK] Seq=239581 Ack=542 Win=123 Len=1452 [TCP segment of a reassembled PDU]"
"341","2.130570","192.168.1.2","160.36.131.221","TCP","54","50572  >  80 [ACK] Seq=542 Ack=241033 Win=1026 Len=0"
"342","2.131179","160.36.131.221","192.168.1.2","TCP","1506","80  >  50572 [ACK] Seq=241033 Ack=542 Win=123 Len=1452 [TCP segment of a reassembled PDU]"
"343","2.131179","160.36.131.221","192.168.1.2","TCP","1506","80  >  50572 [PSH, ACK] Seq=242485 Ack=542 Win=123 Len=1452 [TCP segment of a reassembled PDU]"
"344","2.131179","160.36.131.221","192.168.1.2","TCP","1506","80  >  50572 [ACK] Seq=243937 Ack=542 Win=123 Len=1452 [TCP segment of a reassembled PDU]"
"345","2.131195","192.168.1.2","160.36.131.221","TCP","54","50572  >  80 [ACK] Seq=542 Ack=245389 Win=1026 Len=0"
"346","2.131231","160.36.131.221","192.168.1.2","TCP","1506","80  >  50572 [ACK] Seq=245389 Ack=542 Win=123 Len=1452 [TCP segment of a reassembled PDU]"
"347","2.131240","192.168.1.2","160.36.131.221","TCP","54","50572  >  80 [ACK] Seq=542 Ack=246841 Win=1026 Len=0"
"348","2.131474","160.36.131.221","192.168.1.2","TCP","1506","80  >  50572 [ACK] Seq=246841 Ack=542 Win=123 Len=1452 [TCP segment of a reassembled PDU]"
"349","2.132102","160.36.131.221","192.168.1.2","TCP","1506","80  >  50572 [ACK] Seq=248293 Ack=542 Win=123 Len=1452 [TCP segment of a reassembled PDU]"
"350","2.132102","160.36.131.221","192.168.1.2","TCP","1506","80  >  50572 [ACK] Seq=249745 Ack=542 Win=123 Len=1452 [TCP segment of a reassembled PDU]"
"351","2.132117","192.168.1.2","160.36.131.221","TCP","54","50572  >  80 [ACK] Seq=542 Ack=251197 Win=1026 Len=0"
"352","2.132213","160.36.131.221","192.168.1.2","TCP","1506","80  >  50572 [ACK] Seq=251197 Ack=542 Win=123 Len=1452 [TCP segment of a reassembled PDU]"
"353","2.132222","192.168.1.2","160.36.131.221","TCP","54","50572  >  80 [ACK] Seq=542 Ack=252649 Win=1026 Len=0"
"355","2.132770","160.36.131.221","192.168.1.2","TCP","1506","80  >  50572 [ACK] Seq=252649 Ack=542 Win=123 Len=1452 [TCP segment of a reassembled PDU]"
"356","2.132770","160.36.131.221","192.168.1.2","TCP","1506","80  >  50572 [ACK] Seq=254101 Ack=542 Win=123 Len=1452 [TCP segment of a reassembled PDU]"
"357","2.132787","192.168.1.2","160.36.131.221","TCP","54","50572  >  80 [ACK] Seq=542 Ack=255553 Win=1026 Len=0"
"358","2.132980","160.36.131.221","192.168.1.2","TCP","1506","80  >  50572 [ACK] Seq=255553 Ack=542 Win=123 Len=1452 [TCP segment of a reassembled PDU]"
"359","2.133227","160.36.131.221","192.168.1.2","TCP","1506","80  >  50572 [ACK] Seq=257005 Ack=542 Win=123 Len=1452 [TCP segment of a reassembled PDU]"
"360","2.133227","160.36.131.221","192.168.1.2","TCP","1506","80  >  50572 [ACK] Seq=258457 Ack=542 Win=123 Len=1452 [TCP segment of a reassembled PDU]"
"361","2.133240","192.168.1.2","160.36.131.221","TCP","54","50572  >  80 [ACK] Seq=542 Ack=259909 Win=1026 Len=0"
"362","2.133473","160.36.131.221","192.168.1.2","TCP","1506","80  >  50572 [ACK] Seq=259909 Ack=542 Win=123 Len=1452 [TCP segment of a reassembled PDU]"
"363","2.133484","192.168.1.2","160.36.131.221","TCP","54","50572  >  80 [ACK] Seq=542 Ack=261361 Win=1026 Len=0"
"364","2.133877","160.36.131.221","192.168.1.2","TCP","1506","80  >  50572 [ACK] Seq=261361 Ack=542 Win=123 Len=1452 [TCP segment of a reassembled PDU]"
"365","2.134089","160.36.131.221","192.168.1.2","TCP","1506","80  >  50572 [ACK] Seq=262813 Ack=542 Win=123 Len=1452 [TCP segment of a reassembled PDU]"
"366","2.134104","192.168.1.2","160.36.131.221","TCP","54","50572  >  80 [ACK] Seq=542 Ack=264265 Win=1026 Len=0"
"367","2.134250","160.36.131.221","192.168.1.2","TCP","1506","80  >  50572 [ACK] Seq=264265 Ack=542 Win=123 Len=1452 [TCP segment of a reassembled PDU]"
"368","2.134674","160.36.131.221","192.168.1.2","TCP","1506","80  >  50572 [ACK] Seq=265717 Ack=542 Win=123 Len=1452 [TCP segment of a reassembled PDU]"
"369","2.134689","192.168.1.2","160.36.131.221","TCP","54","50572  >  80 [ACK] Seq=542 Ack=267169 Win=1026 Len=0"
"370","2.134892","160.36.131.221","192.168.1.2","TCP","1506","80  >  50572 [ACK] Seq=267169 Ack=542 Win=123 Len=1452 [TCP segment of a reassembled PDU]"
"371","2.135080","160.36.131.221","192.168.1.2","TCP","1506","80  >  50572 [ACK] Seq=268621 Ack=542 Win=123 Len=1452 [TCP segment of a reassembled PDU]"
"372","2.135091","192.168.1.2","160.36.131.221","TCP","54","50572  >  80 [ACK] Seq=542 Ack=270073 Win=1026 Len=0"
"373","2.135312","160.36.131.221","192.168.1.2","TCP","1506","80  >  50572 [ACK] Seq=270073 Ack=542 Win=123 Len=1452 [TCP segment of a reassembled PDU]"
"374","2.135530","160.36.131.221","192.168.1.2","TCP","1506","80  >  50572 [ACK] Seq=271525 Ack=542 Win=123 Len=1452 [TCP segment of a reassembled PDU]"
"375","2.135545","192.168.1.2","160.36.131.221","TCP","54","50572  >  80 [ACK] Seq=542 Ack=272977 Win=1026 Len=0"
"376","2.135713","160.36.131.221","192.168.1.2","TCP","1506","80  >  50572 [ACK] Seq=272977 Ack=542 Win=123 Len=1452 [TCP segment of a reassembled PDU]"
"377","2.136383","160.36.131.221","192.168.1.2","TCP","1506","80  >  50572 [ACK] Seq=274429 Ack=542 Win=123 Len=1452 [TCP segment of a reassembled PDU]"
"378","2.136383","160.36.131.221","192.168.1.2","TCP","1506","80  >  50572 [ACK] Seq=275881 Ack=542 Win=123 Len=1452 [TCP segment of a reassembled PDU]"
"379","2.136383","160.36.131.221","192.168.1.2","TCP","1506","80  >  50572 [ACK] Seq=277333 Ack=542 Win=123 Len=1452 [TCP segment of a reassembled PDU]"
"380","2.136412","192.168.1.2","160.36.131.221","TCP","54","50572  >  80 [ACK] Seq=542 Ack=278785 Win=1026 Len=0"
"381","2.136489","160.36.131.221","192.168.1.2","TCP","1506","80  >  50572 [ACK] Seq=278785 Ack=542 Win=123 Len=1452 [TCP segment of a reassembled PDU]"
